{
  "$schema": "https://json-schema.org/draft/2020-12/schema",
  "$id": "https://github.com/simai/ui-builder/schemas/simai.framework.unit-usage.v1.schema.json",
  "x-simai-version": "1.0.0",
  "title": "SIMAI Framework unit usage record",
  "description": "A consumer's record of the SIMAI Framework units it relies on and where (standard simai.linkage 1.0.0, requirements 11-13): the source and release it was last brought up to, and for every place it uses units -- a Figma node or component key, a documentation page, a project file or screen, an example -- each unit's id, version and content hash as the inventory of that release gave them. Foundations (token sets, fonts, icon sets) are not listed by hand: scripts/reconcile.mjs follows the inventory's dependencies. The record lives with the consumer; the source never reads it.",
  "type": "object",
  "additionalProperties": false,
  "required": [
    "schema",
    "schema_version",
    "consumer",
    "sources",
    "places"
  ],
  "properties": {
    "$schema": {
      "type": "string",
      "description": "Optional editor hint."
    },
    "schema": {
      "const": "simai.framework.unit-usage"
    },
    "schema_version": {
      "const": 1
    },
    "consumer": {
      "type": "object",
      "additionalProperties": false,
      "required": [
        "id",
        "kind"
      ],
      "properties": {
        "id": {
          "type": "string",
          "minLength": 1,
          "description": "The consumer's own name, e.g. ui-kit, ui-doc, larena-admin."
        },
        "kind": {
          "enum": [
            "figma-kit",
            "docs",
            "product",
            "project",
            "example",
            "other"
          ]
        },
        "title": {
          "type": "string"
        }
      }
    },
    "sources": {
      "type": "array",
      "minItems": 1,
      "description": "Every source the consumer takes units from, with the release it was last brought up to.",
      "items": {
        "type": "object",
        "additionalProperties": false,
        "required": [
          "source",
          "release"
        ],
        "properties": {
          "source": {
            "type": "string",
            "minLength": 1,
            "description": "The repository the units come from, as the inventory names it: simai/ui-source, simai/ui-pro, a component package."
          },
          "release": {
            "type": [
              "string",
              "null"
            ],
            "pattern": "^[a-z][a-z0-9-]*-[a-f0-9]{12}$",
            "description": "The release the consumer was brought up to: ui-<12 hex>, larena-<12 hex>, ..."
          },
          "revision": {
            "type": "string",
            "pattern": "^[a-f0-9]{40}$",
            "description": "The source commit of that release's inventory."
          },
          "brought_up_on": {
            "type": "string",
            "pattern": "^[0-9]{4}-[0-9]{2}-[0-9]{2}$",
            "description": "The date the consumer was brought up to that release; change-journal entries recorded later that carry no unit version are matched by it."
          }
        }
      }
    },
    "places": {
      "type": "array",
      "items": {
        "type": "object",
        "additionalProperties": false,
        "required": [
          "place",
          "units"
        ],
        "properties": {
          "place": {
            "type": "string",
            "minLength": 1,
            "description": "A free-form locator: a Figma node id or component key, a documentation page path, a project file or screen, an example."
          },
          "note": {
            "type": "string"
          },
          "units": {
            "type": "array",
            "minItems": 1,
            "items": {
              "type": "object",
              "additionalProperties": false,
              "required": [
                "id",
                "version",
                "content_sha256"
              ],
              "properties": {
                "id": {
                  "type": "string",
                  "pattern": "^[a-z][a-z0-9-]*\\.[a-z0-9][a-z0-9.-]*$"
                },
                "version": {
                  "type": "string",
                  "pattern": "^(0|[1-9][0-9]*)\\.(0|[1-9][0-9]*)\\.(0|[1-9][0-9]*)$"
                },
                "content_sha256": {
                  "type": "string",
                  "pattern": "^[a-f0-9]{64}$"
                },
                "source": {
                  "type": "string",
                  "minLength": 1,
                  "description": "Optional: the source of this unit when the record names several sources and the id alone does not tell."
                }
              }
            }
          }
        }
      }
    }
  }
}
